{
  "$schema": "https://mandolin.github.io/HIA-Documentation/schemas/dotnetdoc-config-1.0.0.schema.json",
  "schemaVersion": "1.0.0",
  "workspaceRoot": ".",
  "outputDirectory": "dist/dotnetdoc",
  "inputs": [
    {
      "kind": "dotnet-xml-doc",
      "path": "xml-doc/Portal.Components.xml",
      "artifactBasePath": "Portal.Components",
      "hiaDocumentId": "dotnetdoc:Portal.Components",
      "title": "Portal.Components API"
    }
  ],
  "options": {
    "writeResultManifest": true
  }
}
